1, sairamsr, Sridhar Sairam, srisais, enrolled, [partner liaison] [Developer]
2, sayinege, Ege Sayin, egesayin, enrolled, [lead][Mentor Developer]
3, kovacsm2, Martin Kovacs, mkovacs02, enrolled,  [Mentor Developer][Designer]
4, atesmeli, Ozgen Ates, ozgen95, enrolled, [partner liaison] [Developer]
5, mazumd48, Kowshik Mazumdar, re-Koe, enrolled, [Mentor Developer]
6, mckeenic, Nicholas Mckee, mckeenicholas, enrolled,  [Mentor Developer][Tech Consultant]
7, sainanim, Monica Sainani, sainanim, enrolled, [Mentor Developer][Tech Consultant]
